{
  "$schema": "https://json-schema.org/draft/2020-12/schema",
  "$id": "urn:oim:schema:1.0:conformance-claim.schema.json",
  "title": "Open Integration Manifest conformance claim",
  "additionalProperties": false,
  "type": "object",
  "required": ["oimVersion", "runtime", "profiles", "passedCases"],
  "properties": {
    "oimVersion": {
      "const": "1.0",
      "type": "string"
    },
    "runtime": {
      "additionalProperties": false,
      "type": "object",
      "required": ["name", "version"],
      "properties": {
        "name": {
          "minLength": 1,
          "type": "string"
        },
        "version": {
          "minLength": 1,
          "type": "string"
        }
      }
    },
    "profiles": {
      "additionalProperties": false,
      "type": "object",
      "required": ["core"],
      "properties": {
        "core": {
          "type": "string",
          "enum": ["1.0", "1.1", "1.2", "1.3", "1.4"]
        },
        "auth": {
          "type": "string",
          "enum": ["1.0", "1.1"]
        },
        "events": {
          "type": "string",
          "enum": ["1.0"]
        },
        "knowledge": {
          "type": "string",
          "enum": ["1.0", "1.1", "1.2"]
        },
        "hooks": {
          "type": "string",
          "enum": ["1.0"]
        }
      }
    },
    "passedCases": {
      "uniqueItems": true,
      "type": "array",
      "items": {
        "pattern": "^[a-z]+(?:[.-][a-z0-9]+)+$",
        "type": "string"
      }
    }
  }
}
